{
  "$schema": "rusty.quest.connection_hub_labs_release.v1",
  "product": "Rusty Connection Hub",
  "release_tag": "connection-hub-v0.1.0-alpha.1",
  "channel": "labs",
  "maturity": "alpha",
  "package_name": "io.github.mesmerprism.rustymanifold.broker",
  "version_code": 10001,
  "version_name": "0.1.0-alpha.1",
  "source_revision": "1111111111111111111111111111111111111111",
  "source_tree": "2222222222222222222222222222222222222222",
  "source_url": "https://github.com/MesmerPrism/rusty-quest/tree/1111111111111111111111111111111111111111/apps/manifold-broker-android",
  "manifold_source_revision": "3333333333333333333333333333333333333333",
  "manifold_source_tree": "4444444444444444444444444444444444444444",
  "signer_sha256": "5555555555555555555555555555555555555555555555555555555555555555",
  "artifact_name": "rusty-connection-hub-0.1.0-alpha.1.apk",
  "artifact_sha256": "6666666666666666666666666666666666666666666666666666666666666666",
  "artifact_size": 123456,
  "build_manifest_sha256": "7777777777777777777777777777777777777777777777777777777777777777",
  "release_manifest_debug_operator_absent": true,
  "listener_default": "stopped",
  "transport_classification": "trusted_lan_experimental",
  "confidentiality": "none",
  "production_eligible": false,
  "insecure_trusted_lan_requires_explicit_opt_in": true,
  "arbitrary_remote_commands": false,
  "high_rate_media_data_plane": false
}
